{
  "version": 4,
  "trial_id": "trial-ready-must-sync-control-v1",
  "build_spec_digest": "6e6250745b347e9a8fdf34f9a02a9b58c65034504edd82d61a835899acb7144f",
  "module": {
    "path": "go.etcd.io/raft/v3",
    "version": "v3.6.0"
  },
  "source_path": "\u003cunmodified\u003e",
  "input_source_digest": "64bf7a0ef14de2a4044c02d1ecabb4c2210946c147fb52e2080edb76f4155dbb",
  "output_source_digest": "64bf7a0ef14de2a4044c02d1ecabb4c2210946c147fb52e2080edb76f4155dbb",
  "input_module_digest": "64bf7a0ef14de2a4044c02d1ecabb4c2210946c147fb52e2080edb76f4155dbb",
  "output_module_digest": "64bf7a0ef14de2a4044c02d1ecabb4c2210946c147fb52e2080edb76f4155dbb",
  "sut_build_identity": "sut-5b83c9e4579067c0",
  "binary_path": "artifacts/pilots/etcdraft-ready-must-sync-v1/bin/sut-5b83c9e4579067c0",
  "binary_digest": "d5c807429009ae3f74f6e9121734ddd606c06db0f5064602377635dd9b3b97b3",
  "command_identity": "961e4e53298b1e4a69c6e083919eb7ef8147e2e75d44d82d9152a793dd4aa93a",
  "commands": [
    {
      "identity": "go-list-module",
      "digest": "31180163a6c1039d91283d0e6033726684c7630e6a022010380d5fe2c7b5bb5d",
      "executable": "go",
      "logical_args": [
        "list",
        "-mod=readonly",
        "-m",
        "-json",
        "go.etcd.io/raft/v3"
      ],
      "environment": [
        "GOPROXY=off",
        "GOSUMDB=off",
        "GOWORK=off",
        "GOFLAGS=",
        "GOTOOLCHAIN=local"
      ],
      "command_policy": "exact-allowlist-v1"
    },
    {
      "identity": "go-build",
      "digest": "dc9b9bb42f51cb8c4fe2e2eecaa3845d59cd5601f8df0d5b5d903e62afa24460",
      "executable": "go",
      "logical_args": [
        "build",
        "-mod=readonly",
        "-trimpath",
        "-buildvcs=false",
        "-modfile=\u003cgenerated\u003e",
        "-ldflags=-buildid= -X=github.com/SuzumiyaHaruki/consensus-atlas/drivers/etcdraft.SUTBuildIdentity=sut-5b83c9e4579067c0",
        "-o",
        "artifacts/pilots/etcdraft-ready-must-sync-v1/bin/sut-5b83c9e4579067c0",
        "./cmd/campaign"
      ],
      "environment": [
        "GOPROXY=off",
        "GOSUMDB=off",
        "GOWORK=off",
        "GOFLAGS=",
        "GOTOOLCHAIN=local"
      ],
      "command_policy": "exact-allowlist-v1"
    }
  ],
  "toolchain_identity": "go1.25.8/linux/amd64",
  "module_cache_unmodified": true,
  "offline_readonly_build": true,
  "exact_match_count": 0
}
